{
  "id": "orders",
  "name": "Orders",
  "type": "global",
  "tenantId": "(platform)",
  "statements": [
    { "name": "read-orders", "action": { "path": { "pattern": "/orders/**", "method": "GET" } }, "condition": { "authenticated": {} } },
    { "name": "no-internal", "effect": "deny", "action": "/orders/internal/**" }
  ]
}
